{
  "package_id": "QP-ECOLOOM-PROD-2026-001",
  "project_name": "Eco-Loom Scrubber Handle Production",
  "customer_name": "ECO-LOOM",
  "project_ref": "projects/eco_loom/eco_loom_project_capture_v1.json",
  "created_at": "2026-06-11T12:00:00Z",
  "status": "active",
  "revisions": [
    {
      "revision_id": "QR-ECOLOOM-PROD-2026-001-A",
      "revision_letter": "A",
      "revision_ref": "projects/eco_loom/eco_loom_production_quote_revision_a_v1.json",
      "status": "active"
    }
  ],
  "notes": [
    "Production quote package for Eco-Loom scrubber handle",
    "Shop-supplied materials (wood and Velcro)",
    "Three quantity options: 100, 250, 500 units"
  ]
}
